{
  "$schema": "../../schemas/v1/pricing.schema.json",
  "model": "nanobana_pro",
  "operation": "text_to_image",
  "pricing_version": "2026-09-v1",
  "currency": "credits",
  "base_price": 10,
  "modifiers": {
    "resolution": {
      "1k": { "type": "multiplier", "factor": 1.0, "description": "1K Resolution (1.0x)" },
      "2k": { "type": "multiplier", "factor": 1.6, "description": "2K Resolution (1.6x)" },
      "4k": { "type": "multiplier", "factor": 2.5, "description": "4K Resolution (2.5x)" }
    },
    "quality": {
      "standard": { "type": "multiplier", "factor": 1.0, "description": "Standard Quality" },
      "hd": { "type": "multiplier", "factor": 1.3, "description": "HD Quality (1.3x)" }
    },
    "prompt_enhancer": {
      "true": { "type": "flat_addon", "amount": 2, "description": "Prompt Enhancement (+2 credits)" }
    }
  }
}
